{
  "schema": "nsrl.wisdom_receipt.v0",
  "receipt_id": "wisdom-c51745bf146641f0c1d78b4e",
  "recorded_at": "2026-07-15T21:30:00Z",
  "mode": "shadow",
  "request": {
    "request_id": "successor-v2-status-shadow-001",
    "question": "Should the repaired native successor be recorded as passing its frozen substrate promotion gate?",
    "request_sha256": "c51745bf146641f0c1d78b4ebc489e0f4e2d82f69a394161e4aac3a07686f6f9"
  },
  "bindings": {
    "models": [
      {
        "model_id": "integer-transformer-successor-v2",
        "artifact_uri": "benchmarks/integer-transformer-proof-v1/successor-v2-candidate.nsrlmt",
        "artifact_sha256": "89260e3cae329677e132eef4439d784c6290e8e46b8779c3667da8d157bf7259",
        "role": "underlying native model"
      }
    ],
    "trust_root": {
      "path": "council/trust-root-v0.json",
      "sha256": "20ec8f1f8e289eaf1a9e56d5b5b4c51fbd592f146fcdd3dafc04feba8ffb95a7",
      "key_id": "nsrl-solomon-council-offline-root-2026-07-v0"
    },
    "sources": [
      {
        "evidence_id": "training-receipt",
        "source_uri": "benchmarks/integer-transformer-proof-v1/successor-v2-training.json",
        "source_sha256": "42a6fa80102fd787ace7cd3655fe600c2b09c82a78e932d5b05160309cb8e48c",
        "content_sha256": "42a6fa80102fd787ace7cd3655fe600c2b09c82a78e932d5b05160309cb8e48c"
      },
      {
        "evidence_id": "evaluation-evidence",
        "source_uri": "benchmarks/integer-transformer-proof-v1/successor-v2-evidence.json",
        "source_sha256": "5a67581388751a68a049f8fec728051aeb1539b6769fd4c43b0ac783594e0f87",
        "content_sha256": "5a67581388751a68a049f8fec728051aeb1539b6769fd4c43b0ac783594e0f87"
      }
    ]
  },
  "retrieved_evidence": [
    {
      "evidence_id": "training-receipt",
      "source_uri": "benchmarks/integer-transformer-proof-v1/successor-v2-training.json",
      "source_sha256": "42a6fa80102fd787ace7cd3655fe600c2b09c82a78e932d5b05160309cb8e48c",
      "content_sha256": "42a6fa80102fd787ace7cd3655fe600c2b09c82a78e932d5b05160309cb8e48c",
      "retrieved_at": "2026-07-15T21:25:00Z",
      "summary": "Canonical training-only integer NLL receipt with zero unsupported byte classes and no held-out access.",
      "claim_ids": [
        "canonical-training",
        "no-hidden-assistance"
      ],
      "accessible_to": [
        "mathematician",
        "engineer",
        "historian",
        "skeptic",
        "consequence_planner",
        "judge"
      ]
    },
    {
      "evidence_id": "evaluation-evidence",
      "source_uri": "benchmarks/integer-transformer-proof-v1/successor-v2-evidence.json",
      "source_sha256": "5a67581388751a68a049f8fec728051aeb1539b6769fd4c43b0ac783594e0f87",
      "content_sha256": "5a67581388751a68a049f8fec728051aeb1539b6769fd4c43b0ac783594e0f87",
      "retrieved_at": "2026-07-15T21:25:00Z",
      "summary": "Five-system frozen evaluation showing 25,347,655 millibits, zero zero-probability windows, and exact replay hashes.",
      "claim_ids": [
        "heldout-nll",
        "zero-probability",
        "baseline-comparison"
      ],
      "accessible_to": [
        "mathematician",
        "engineer",
        "historian",
        "skeptic",
        "consequence_planner",
        "judge"
      ]
    }
  ],
  "faculty_invocations": [
    {
      "invocation_id": "successor-v2-status-shadow-001:mathematician",
      "faculty_id": "mathematician",
      "seal": {
        "seal_id": "seal-solomon-mathematician-v0",
        "manifest_path": "council/seals/mathematician.json",
        "manifest_sha256": "f51bfe634f664d644dc8b2a93104859cb9ea894c878dce949a5857a25044569c",
        "signature_verified": true
      },
      "circle": {
        "faculty_id": "mathematician",
        "permissions": [
          "read:evidence",
          "read:model_hashes",
          "recommend:action"
        ],
        "tools": [
          "evidence_reader",
          "metric_checker"
        ],
        "budget": {
          "input_bytes": 16384,
          "output_bytes": 4096,
          "tool_calls": 2,
          "tokens": 2048,
          "wall_clock_ms": 10000
        },
        "usage": {
          "input_bytes": 2083,
          "output_bytes": 720,
          "tool_calls": 2,
          "tokens": 610,
          "wall_clock_ms": 80
        },
        "accessed_evidence_ids": [
          "training-receipt",
          "evaluation-evidence"
        ]
      },
      "recommendation": {
        "disposition": "support",
        "action_id": "record-substrate-promotion",
        "rationale": "The exact canonical NLL is below every frozen comparison and the unsupported-window count is zero.",
        "confidence_milli": 950,
        "calibration_bucket": "900-1000",
        "evidence_ids": [
          "training-receipt",
          "evaluation-evidence"
        ],
        "contradictions": [],
        "predicted_consequences": [
          {
            "action_id": "record-substrate-promotion",
            "horizon": "immediate",
            "description": "The substrate status becomes mathematically consistent with the frozen table.",
            "impact_milli": 600,
            "confidence_milli": 950
          }
        ],
        "missing_information": []
      }
    },
    {
      "invocation_id": "successor-v2-status-shadow-001:engineer",
      "faculty_id": "engineer",
      "seal": {
        "seal_id": "seal-solomon-engineer-v0",
        "manifest_path": "council/seals/engineer.json",
        "manifest_sha256": "25eb3f65a15b21899352cc893e5d12c45d44360f4019ecd536fa1d4d9a3d450e",
        "signature_verified": true
      },
      "circle": {
        "faculty_id": "engineer",
        "permissions": [
          "read:evidence",
          "read:model_hashes",
          "recommend:action"
        ],
        "tools": [
          "artifact_inspector",
          "evidence_reader"
        ],
        "budget": {
          "input_bytes": 16384,
          "output_bytes": 4096,
          "tool_calls": 2,
          "tokens": 2048,
          "wall_clock_ms": 10000
        },
        "usage": {
          "input_bytes": 2894,
          "output_bytes": 690,
          "tool_calls": 2,
          "tokens": 590,
          "wall_clock_ms": 110
        },
        "accessed_evidence_ids": [
          "training-receipt",
          "evaluation-evidence"
        ]
      },
      "recommendation": {
        "disposition": "support",
        "action_id": "record-substrate-promotion",
        "rationale": "The candidate, receipt, evidence, and replay identities are bound and the recommendation is reversible documentation work.",
        "confidence_milli": 900,
        "calibration_bucket": "900-1000",
        "evidence_ids": [
          "training-receipt",
          "evaluation-evidence"
        ],
        "contradictions": [],
        "predicted_consequences": [
          {
            "action_id": "record-substrate-promotion",
            "horizon": "next check run",
            "description": "Repository checks continue to reproduce the candidate before accepting its status.",
            "impact_milli": 500,
            "confidence_milli": 900
          }
        ],
        "missing_information": []
      }
    },
    {
      "invocation_id": "successor-v2-status-shadow-001:historian",
      "faculty_id": "historian",
      "seal": {
        "seal_id": "seal-solomon-historian-v0",
        "manifest_path": "council/seals/historian.json",
        "manifest_sha256": "b35f05bf0e1d3a52dab460106cafd430091210bfff244f94947692c84d36e237",
        "signature_verified": true
      },
      "circle": {
        "faculty_id": "historian",
        "permissions": [
          "read:evidence",
          "read:model_hashes",
          "recommend:action"
        ],
        "tools": [
          "evidence_reader",
          "source_catalog"
        ],
        "budget": {
          "input_bytes": 16384,
          "output_bytes": 4096,
          "tool_calls": 2,
          "tokens": 2048,
          "wall_clock_ms": 10000
        },
        "usage": {
          "input_bytes": 2894,
          "output_bytes": 680,
          "tool_calls": 2,
          "tokens": 570,
          "wall_clock_ms": 95
        },
        "accessed_evidence_ids": [
          "training-receipt",
          "evaluation-evidence"
        ]
      },
      "recommendation": {
        "disposition": "support",
        "action_id": "record-substrate-promotion",
        "rationale": "The proposed wording distinguishes the repaired active artifact from the preserved first falsification and from product release.",
        "confidence_milli": 820,
        "calibration_bucket": "800-899",
        "evidence_ids": [
          "training-receipt",
          "evaluation-evidence"
        ],
        "contradictions": [],
        "predicted_consequences": [],
        "missing_information": []
      }
    },
    {
      "invocation_id": "successor-v2-status-shadow-001:skeptic",
      "faculty_id": "skeptic",
      "seal": {
        "seal_id": "seal-solomon-skeptic-v0",
        "manifest_path": "council/seals/skeptic.json",
        "manifest_sha256": "e73822d91c8244904fa3ce7239390cf39aaee5e8c6030c68a98c940a3dc84608",
        "signature_verified": true
      },
      "circle": {
        "faculty_id": "skeptic",
        "permissions": [
          "read:evidence",
          "read:model_hashes",
          "recommend:action"
        ],
        "tools": [
          "evidence_reader",
          "contradiction_checker"
        ],
        "budget": {
          "input_bytes": 16384,
          "output_bytes": 4096,
          "tool_calls": 2,
          "tokens": 2048,
          "wall_clock_ms": 10000
        },
        "usage": {
          "input_bytes": 2894,
          "output_bytes": 850,
          "tool_calls": 2,
          "tokens": 710,
          "wall_clock_ms": 105
        },
        "accessed_evidence_ids": [
          "training-receipt",
          "evaluation-evidence"
        ]
      },
      "recommendation": {